{
  "schemaVersion": "0.3.0",
  "id": "main",
  "name": "Main",
  "size": {
    "width": 1280,
    "height": 720
  },
  "items": [
    {
      "id": "bar1",
      "type": "widget",
      "widget": "bar",
      "x": 0,
      "y": 0,
      "width": 400,
      "height": 260,
      "props": {
        "orientation": "vertical",
        "decimals": 0,
        "showValues": false,
        "labels": [],
        "min": 0,
        "max": 1
      },
      "tags": {
        "series": [
          "M.T001"
        ]
      }
    }
  ]
}
