{
  "schemaVersion": "0.3.0",
  "id": "main",
  "name": "Main",
  "size": {
    "width": 1280,
    "height": 720
  },
  "items": [
    {
      "id": "al1",
      "type": "widget",
      "widget": "alarm-list",
      "x": 10,
      "y": 10,
      "width": 640,
      "height": 260,
      "props": {
        "areas": [
          "a0",
          "a1",
          "a2",
          "a3",
          "a4",
          "a5",
          "a6",
          "a7",
          "a8",
          "a9",
          "a10",
          "a11",
          "a12",
          "a13",
          "a14",
          "a15",
          "a16",
          "a17",
          "a18",
          "a19",
          "a20",
          "a21",
          "a22",
          "a23",
          "a24",
          "a25",
          "a26",
          "a27",
          "a28",
          "a29",
          "a30",
          "a31",
          "a32",
          "a33",
          "a34",
          "a35",
          "a36",
          "a37",
          "a38",
          "a39",
          "a40",
          "a41",
          "a42",
          "a43",
          "a44",
          "a45",
          "a46",
          "a47",
          "a48",
          "a49",
          "a50",
          "a51",
          "a52",
          "a53",
          "a54",
          "a55",
          "a56",
          "a57",
          "a58",
          "a59",
          "a60",
          "a61",
          "a62",
          "a63",
          "a64"
        ]
      }
    }
  ]
}
