{
  "schemaVersion": "0.3.0",
  "id": "main",
  "name": "Main",
  "kind": "screen",
  "size": {
    "width": 1280,
    "height": 720
  },
  "fitMode": "contain",
  "items": [
    {
      "id": "x1",
      "type": "widget",
      "widget": "panel",
      "x": 1279,
      "y": 719,
      "width": 300,
      "height": 200
    }
  ]
}
