{
  "schemaVersion": "0.3.0",
  "id": "main",
  "name": "Main",
  "size": {
    "width": 1280,
    "height": 720
  },
  "items": [
    {
      "id": "label1",
      "type": "widget",
      "widget": "label",
      "x": 0,
      "y": 0,
      "width": 200,
      "height": 40,
      "props": {
        "text": "",
        "fontSize": 8,
        "bold": false,
        "align": "left",
        "color": "auto",
        "wrap": false,
        "decimals": 0
      }
    }
  ]
}
