{
  "id": "main",
  "name": "Main",
  "size": {
    "width": 1280,
    "height": 720
  },
  "items": [
    {
      "id": "b1",
      "type": "widget",
      "widget": "history-bar",
      "x": 10,
      "y": 10,
      "width": 480,
      "height": 280,
      "props": {
        "group": "ap-suat",
        "bucket": "day",
        "period": "last30d"
      },
      "tags": {
        "series": [
          "L.LEVEL"
        ]
      }
    }
  ],
  "schemaVersion": "0.6.0"
}
