{
  "schemaVersion": "0.3.0",
  "id": "main",
  "name": "Main",
  "size": {
    "width": 1280,
    "height": 720
  },
  "items": [
    {
      "id": "stacklight1",
      "type": "widget",
      "widget": "stack-light",
      "x": 0,
      "y": 0,
      "width": 90,
      "height": 200,
      "props": {
        "label": "",
        "orientation": "vertical",
        "blinkRed": false
      }
    }
  ]
}
