{
  "schemaVersion": "0.3.0",
  "id": "main",
  "name": "Main",
  "size": {
    "width": 1280,
    "height": 720
  },
  "items": [
    {
      "id": "image1",
      "type": "widget",
      "widget": "image",
      "x": 0,
      "y": 0,
      "width": 1200,
      "height": 700,
      "props": {
        "title": "ằằằằằằằằằằằằằằằằằằằằằằằằằằằằằằằằằằằằằằằằằằằằằằằằằằằằằằằằằằằằ",
        "src": "",
        "fit": "cover",
        "alt": "ằằằằằằằằằằằằằằằằằằằằằằằằằằằằằằằằằằằằằằằằằằằằằằằằằằằằằằằằằằằằằằằằằằằằằằằằằằằằằằằằ"
      }
    }
  ]
}
