{
  "id": "main",
  "name": "Main",
  "size": {
    "width": 1280,
    "height": 720
  },
  "items": [
    {
      "id": "p1",
      "type": "widget",
      "widget": "history-pie",
      "x": 0,
      "y": 0,
      "width": 700,
      "height": 700,
      "props": {
        "group": "lon",
        "fn": "avg",
        "period": "lastMonth",
        "shiftCount": 12,
        "shiftStart": "23:59",
        "donut": true,
        "decimals": 6,
        "showPercent": true,
        "showTotal": true,
        "labels": [
          "ằằằằằằằằằằằằằằằằằằằằằằằằằằằằằằằằằằằằằằằằ",
          "ằằằằằằằằằằằằằằằằằằằằằằằằằằằằằằằằằằằằằằằằ",
          "ằằằằằằằằằằằằằằằằằằằằằằằằằằằằằằằằằằằằằằằằ",
          "ằằằằằằằằằằằằằằằằằằằằằằằằằằằằằằằằằằằằằằằằ",
          "ằằằằằằằằằằằằằằằằằằằằằằằằằằằằằằằằằằằằằằằằ",
          "ằằằằằằằằằằằằằằằằằằằằằằằằằằằằằằằằằằằằằằằằ",
          "ằằằằằằằằằằằằằằằằằằằằằằằằằằằằằằằằằằằằằằằằ",
          "ằằằằằằằằằằằằằằằằằằằằằằằằằằằằằằằằằằằằằằằằ"
        ],
        "refreshSec": 3600
      },
      "tags": {
        "series": [
          "M.T001",
          "M.T002",
          "M.T003",
          "M.T004",
          "M.T005",
          "M.T006",
          "M.T007",
          "M.T008"
        ]
      }
    }
  ],
  "schemaVersion": "0.6.0"
}
