{
  "schemaVersion": "0.3.0",
  "id": "main",
  "name": "Main",
  "size": {
    "width": 1280,
    "height": 720
  },
  "items": [
    {
      "id": "s1",
      "type": "widget",
      "widget": "setpoint",
      "x": 10,
      "y": 10,
      "width": 300,
      "height": 200,
      "props": {
        "min": 0,
        "max": 91
      },
      "tags": {
        "target": "L.SP"
      }
    }
  ]
}
