{
  "schemaVersion": "0.3.0",
  "id": "main",
  "name": "Main",
  "kind": "screen",
  "size": {
    "width": 1280,
    "height": 720
  },
  "fitMode": "contain",
  "items": [
    {
      "id": "w1",
      "type": "widget",
      "widget": "line",
      "x": 10,
      "y": 10,
      "width": 240,
      "height": 140,
      "tags": {
        "series": [
          "TANK01.LEVEL"
        ]
      }
    }
  ]
}
