{
  "schemaVersion": "0.3.0",
  "id": "main",
  "name": "Main",
  "size": {
    "width": 1280,
    "height": 720
  },
  "items": [
    {
      "id": "ac1",
      "type": "widget",
      "widget": "alarm-count",
      "x": 10,
      "y": 10,
      "width": 120,
      "height": 48,
      "props": {
        "minPriority": "x"
      }
    }
  ]
}
